{
    "result": {
        "ticketId": "B0034827552620261",
        "status": "accepted",
        "reason": {
            "code": 1024,
            "message": "ticket accepted",
            "internalMessage": "ticket accepted"
        },
        "betDetails": []
    },
    "version": "2.0",
    "signature": "qWh5cEAJJlr4QLNBTY+rk13OI8jPkhJNA/wW2gbEI4I=",
    "exchangeRate": 10000
}